"Log Number",Description,"Supplement Indicator",Institution,"Fiscal Year",Program,"Federal Funds","Funding Office",City,State
NG-03-17-0223-17,"The purpose of the Chilkat Indian Village's Xux' Daaka Hidi: Chilkat Stories: Our Village, Our Lives project is to document, preserve, and share elders' stories as well as the stories of other tribal members; increase knowledge about and interest in Chilkat heritage; and help meet the mission of the Tribe, school, and library. Project activities include storytelling events during Culture Day celebrations, posting interviews online, and making the interviews available at the library.",0,"Chilkat Indian Village",2017,"Native American Library Services: Enhancement Grants",$149669,"Office of Library Services",Haines,AK
NG-03-17-0224-17,"The Kaw Nation will broaden its services, helping increase membership and futher engaging the community. The library will add a children's audio section with read along capabilities; create craft time and projects for children and students; make the library more accessible for mothers and their children; provide afterschool tutoring; add a parent-teacher resource section; create a bookclub; offer a coffee nook for older community members; provide an outdoor reading and activity center; and support training and professional development for library staff.",0,"Kaw Nation",2017,"Native American Library Services: Enhancement Grants",$120168,"Office of Library Services","Kaw City",OK
NG-03-17-0225-17,"The Aleutian Pribilof Islands Association, Inc.'s Unangam tunuu Apps: Captivating New Generations project will increase the number of novice-low speakers and revitalize interest among Unangax youth to learn the language of their ancestors. The project team will produce and distribute smartphone apps teaching Eastern and Western dialects of Unangam tunuu as well as form and excecute an advertising campaign to increase awareness of the apps to Aleut Tribal members and others.",0,"Aleutian Pribilof Islands Association, Inc.",2017,"Native American Library Services: Enhancement Grants",$150000,"Office of Library Services",Anchorage,AK
NG-03-17-0226-17,"The Grand Traverse Band of Ottawa and Chippewa Indians' project will help address community issues by increasing knowledge about computer use and building interest in lifelong learning among children, families, and community members. The proposed work, including updating software and computers as well as hiring a full-time librarian, enhancing the collection, and providing educational programs, supports the Tribal Council's goals of preserving traditions through education and communicating the rich history of the Grand Traverse Band.",0,"Grand Traverse Band of Ottawa and Chippewa Indians",2017,"Native American Library Services: Enhancement Grants",$128675,"Office of Library Services",Peshawbestown,MI
NG-03-17-0245-17,"The Bishop Paiute Tribe's CULTURE program will offer cultural activities around a seasonal calendar to raise self-esteem and self-identity among tribal members and help families understand that cultural ways are just as important as western education. The project focuses on mentoring, training and professional development, and cultivation of partnerships to enhance existing services and target services to people who are underserved. It is designed to show families that they can braid together tradition and new knowledge.",0,"Bishop Indian Tribal Council",2017,"Native American Library Services: Enhancement Grants",$125494,"Office of Library Services",Bishop,CA
NG-03-16-0018-16,"The Makah tribe's Makah Cultural and Research center's Makah Guardian Project will promote stewardship of library collections, provide policy direction, preserve and protect archaeological, linguistic and cultural resources of the Makah Tribe, enhance engagement and cultural opportunities, and provide education about Makah culture, heritage and language of the Makah Tribe. The Guardian Project responds to a community mapping exercise that revealed underutilized community assets and addresses barriers to the audio collections that limit sharing of information and resources to intended audiences. Project activities include: expanding and improving access to audio collections; finalizing digitization and digital policies and procedures; and creating digital recordings of respected Makah tribal leaders to document Makah tribal lore, tradition and knowledge. Audio recordings will be made available through CDs and the Mukurtu Content Management System (CMS).",0,"Makah Indian Tribe",2016,"Native American Library Services: Enhancement Grants",$149973,"Office of Library Services","Neah Bay",WA
NG-03-16-0044-16,"The Quapaw Tribe will preserve and promote its rich heritage; increase access to information for all by enhancing and improving the resources of the library; and promote literacy, especially in the early learning. The project addresses inadequate literacy resources; a need for Native American cultural/historical preservation; a lack of sufficient technology-based resources; and a lack of literacy-based programs for children. It includes adding 400 new materials annually to the collection; conducting two storyhour sessions per week and one family reading night per month; Native culture, crafts, and language-oriented classes and workshops; the creation of a Quapaw Youth Pottery Program and a traditional/crafting/informational program for youth, ages 13 to 19; online services for adults and youth; and the development and implementation of an afterschool program incorporating STEM and literacy.",0,"Quapaw Nation",2016,"Native American Library Services: Enhancement Grants",$147761,"Office of Library Services",Quapaw,OK
NG-03-16-0040-16,"The Hoh Tribal Business Council and the Hoh Tribal Library will support the development of early literacy skills in children, ages birth through eight, by starting a library home visiting program; increase culturally-based children and parenting materials, events and activities available through the library to respond to community needs and recommendations from state and national studies on early literacy development. The library will enhance its early literacy program as it moves into its third year of operation by connecting babies, toddlers, and children up to eight years old and their adult caregivers to a variety of learning experiences to increase children's pre-reading skills and parent/caregivers' awareness of those skills. The project is based on a research-based program, Raising a Reader, which integrates the latest research in early literacy and infant brain development with traditional Native American storytime elements.",0,"Hoh Tribe",2016,"Native American Library Services: Enhancement Grants",$128538,"Office of Library Services",Forks,WA
NG-03-16-0032-16,"The Lac Courte Oreilles (LCO) Ojibwa College Community Library's Avoiding Conflict project addresses Wisconsin Act 31, which was passed in 1989 and mandates that Wisconsin schools teach American Indian studies at least three times during the K-12 career of students. The purpose of the project is to address outdated curriculum and other materials and help school and public librarians have the necessary knowledge, skills, and resources to support Act 31 endeavors in Wisconsin schools. Project activities include collaborating with the Northern Waters Library Service and the Great Lakes Convening Culture Keepers (GLCCK) as well as sharing tribal expertise and resources through training and professional development; establishment and enhancement of electronic resources; creation of an updated manual; and development of library services that will provide access to information for local and system-wide schools and public libraries.",0,"Lac Courte Oreilles Band of Lake Superior Chippewa Indians of Wisconsin",2016,"Native American Library Services: Enhancement Grants",$130247,"Office of Library Services",Hayward,WI
NG-03-16-0017-16,"The Mescalero Community Library, in partnership with the Mescalero Apache Tribe Language Program, will: 1) create culturally appropriate Apache language texts (based on traditional oral literature) and 2) provide community members with user-friendly electronic access to the texts in order to increase Apache language practice among community members. The project builds on prior IMLS support to develop a website and an assessment incorporating feedback from community members who expressed great need to provide the Reservation Community with enhanced access to Apache language educational materials. To make Apache language materials accessible on the Library's website, the project team will record in audio and/or video Apache language narratives; create translations of the narrative; transcribe, analyze, and annotate select narratives; and upload selected language texts in the Apache Literature Collection. Patron engagement with the uploaded texts will be monitored using web analytics to measure and characterize requests and transferred data.",0,"Mescalero Apache Tribe",2016,"Native American Library Services: Enhancement Grants",$113366,"Office of Library Services",Mescalero,NM
NG-03-16-0047-16,"The Medweganoonind Library will undergo a complete overhaul of services by updating the outdated collection and establishing community library programming in order to establish sustainable community programming and increase awareness of library services for Red Lake Nation. The expected outcomes of this project are an increased number of library users and materials checkouts along with the development of positive regard for the library and library services within the Red Lake community. The project team will provide cultural literacy activities and access to technology; make available cultural and popular resources; help build cultural knowledge; and offer technology workshops. Throughout the project, avenues for community involvement in programming and services and library internships for community members will be provided.",0,"Red Lake Band of Chippewa Indians",2016,"Native American Library Services: Enhancement Grants",$144100,"Office of Library Services",Redlake,MN
NG-03-16-0030-16,"The Little Traverse Bay Bands of Odawa Indians will implement a 24-month project to increase digital literacy through the development of two culturally-tailored and multi-week digital literacy programs: eBook Clubs (with up to 20 participants in each session) and Digital Storytelling Workshops (with up to 10 participants in each session). These activities directly target young adults (11-17 years old), adults (18-54 years old) and elders (55 years old and older,) and will increase visitorship and usage, and build cultural intergenerational connectedness. Intended outcomes for audience members are an increase in knowledge of digital literacy tools and cultural themes/topics; an increase in attitude toward cultural connectedness and intergenerational relationships and an increase in behaviors promoting family history development and participation in cultural and community activities and ways of being.",0,"Little Traverse Bay Bands of Odawa Indians",2016,"Native American Library Services: Enhancement Grants",$147380,"Office of Library Services","Harbor Springs",MI
NG-03-16-0037-16,"The James E. Shanley Tribal Library at Fort Peck Community College, which performs the functions of academic library, tribal library and community library for Fort Peck Community College (FPCC), the Fort Peck Assiniboine and Sioux Tribes, and the Poplar community, will engage in a number of activities to address needs as documented by circulation statistics and professional observations. The library will offer training workshops to patrons on the use of different types of equipment and databases; add new materials to the collection to enhance the health sciences areas and current best sellers; move VHS recordings to DVD for use by patrons and make archival copies of elders' interviews; digitize Fort Peck Reservation newspapers; purchase a new copy machine; and hire a part-time assistant to provide patron services for the length of the grant.",0,"Fort Peck Assiniboine and Sioux Tribes",2016,"Native American Library Services: Enhancement Grants",$149527,"Office of Library Services",Poplar,MT
NG-03-16-0046-16,"The Karuk tribe's Xah&#2013270016;vik: Digital Enhancement for Karuk Tribal Libraries' Web (Xah&#2013270016;vik = Web in the Karuk Language) two-year project will address the need to expand the content and augment the capacity and continuity of the Karuk tribe's integrated library program through professional development;  expansion of data capacity and technical support as well as development of a digital strategy policy; populating the collections related to the Karuk language, culture, resource management practices, and traditional knowledge and skills; and providing for lifelong learning through technology training for 27 staff members. Making culturally relevant materials accessible to the greater community will promote Karuk language learning; return traditional ecological knowledge to the tribal community; and support an informed collaborative stewardship of the area by the Tribe and outside partners to promote Karuk cultural revitalization.",0,"Karuk Tribe",2016,"Native American Library Services: Enhancement Grants",$150000,"Office of Library Services","Happy Camp",CA
NG-03-16-0014-16,"The S. Verna Fowler Academic Library/Menominee Public Library, under the direction of the College of Menominee Nation, will create makerspace areas for participatory learning, implement makerspace programming as well as increase the number of youth patrons from middle and high school utilizing the community and youth circulations statistics. The project responds to an assessment of patron statistics, which indicated that only 350 resident children (23 percent of the youth population) use the library and checkout an average of 240 library resources each month. Project activities include designing and furnishing spaces; developing monthly programming around movie-making, stop animation, and photography; surveying participants; and tracking library use pre- and post-project. Formative evaluation activities will document the development and implementation of the program; assess the degree to which the project met its goals and the major learning from project implementation; determine the value of the project to families and national efforts; and describe what was learned that can be transferred to other similar efforts.",0,"Menominee Indian Tribe of Wisconsin",2016,"Native American Library Services: Enhancement Grants",$150000,"Office of Library Services",Keshena,WI
NG-03-16-0251-16,"The Huna Totem Corporation (HTC) the Alaska Native Claims Settlement Act (ANCSA) village corporation for the village of Hoonah, in partnership with the Huna Heritage Foundation (HHF), will develop the Lifting Faces of Our Ancestors digitization project, which has the goals of preserving, perpetuating, and greatly increasing accessibility and use of the cultural and historical photographs and images held in the Huna Heritage Foundation (HHF) Library and Archives. Project activities include: the transfer of 600 photographs held in the library and archives to digital format; the creation of a portal using the Mukurtu Content Management System (CMS) with clan categories for the Huna tribal members; the promotion of the new Mukurtu CMS portal; and an evaluation of the project. The Lifting Faces of Our Ancestors project's primary audience are HTC shareholders, but the work will also serve as a resource for educational and language revitalization efforts in the community and Hoonah School District as well as scholars throughout the world.",0,"Huna Totem Corporation",2016,"Native American Library Services: Enhancement Grants",$149375,"Office of Library Services",Juneau,AK
NG-03-16-0011-16,"The Bear River Band of Rohnerville Rancheria will partner with Tribal children's school libraries and work with school librarians on the recognition of culturally inappropriate and stereotypical books in children's literature and media. Native people are underrepresented and are often misrepresented in books and other media for both adults and children. Project participants will learn how to select appropriate, culturally relevant materials by Native American authors, will tailor services in accordance with acquired knowledge, and will have multiple opportunities to provide feedback to the project team. The project will include distribution of books, two training workshops for a broader audience of public school librarians, county library staff, and local tribal library staff as well as two Native Author programs with students at two of the partners schools.",1,"Bear River Band of Rohnerville Rancheria",2016,"Native American Library Services: Enhancement Grants",$1000,"Office of Library Services",Loleta,CA
NG-03-16-0011-16,"The Bear River Band of Rohnerville Rancheria will partner with Tribal children's school libraries and work with school librarians on the recognition of culturally inappropriate and stereotypical books in children's literature and media. Native people are underrepresented and are often misrepresented in books and other media for both adults and children. Project participants will learn how to select appropriate, culturally relevant materials by Native American authors, will tailor services in accordance with acquired knowledge, and will have multiple opportunities to provide feedback to the project team. The project will include distribution of books, two training workshops for a broader audience of public school librarians, county library staff, and local tribal library staff as well as two Native Author programs with students at two of the partners schools.",0,"Bear River Band of Rohnerville Rancheria",2016,"Native American Library Services: Enhancement Grants",$99484,"Office of Library Services",Loleta,CA
NG-03-16-0033-16,"The Fort Belknap Indian Community Council's Aaniiih Nakoda College Library (ANCL) will promote lifelong learning among residents of the Fort Belknap Indian Reservation through outreach programs that address topics of identified community interest and feature engaging, hands-on educational activities related to STEM (science, technology, engineering and mathematics) and health/wellness, as approached through the lens of Aaniiih and Nakoda language, history and lifeways. Outreach programs will be planned, implemented and evaluated in cooperation with a network of community partners and delivered in all three reservation communities (Fort Belknap Agency, Hays and Lodgepole). Special emphasis will be placed on outreach to youth. Project outcomes include increased community awareness of and participation in programming; amplified interest in and knowledge of science, technology, health/wellness and Aaniiih and Nakoda culture; more use of library resources; and augmented college- and career-readiness among reservation youth. The project will be carried out over a two-year period.",0,"Fort Belknap Indian Community",2016,"Native American Library Services: Enhancement Grants",$149830,"Office of Library Services",Harlem,MT
NG-03-16-0027-16,"The Coyote Valley Band of Pomo Indians will enhance library services through the development of the Advancing Students and Professionals through Innovation, Resources & Education (ASPIRE) Project. The project is designed to spark and nurture youth interest in learning and advanced education and increase access to professional development opportunities for Coyote Valley and neighboring tribes through a new digital media lab/classroom, GED program, and on-site classes. The project responds to a needs assessment that highlighted increased interest in education by youth members, more educational and cultural programming, and an accessible computer lab. The overarching goal of the ASPIRE Project is to improve the lifestyles of tribal members by using education as a gateway to professional development - through access (technology) and opportunities (classes) - while fostering cultural pride. Tangible products will include a digital media lab/classroom and the ASPIRE Planning & Evaluation Model.",0,"Coyote Valley Band of Pomo Indians",2016,"Native American Library Services: Enhancement Grants",$142670,"Office of Library Services","Redwood Valley",CA
NG-03-15-0022-15,"The first objective of this project is to preserve and care for a unique collection of 338 video recordings of traditional Southeast Alaska Native song and dance performances. The performances were presented at ""Celebration"" cultural festivals, sponsored by the Sealaska Heritage Institute between 1982 and 1992. These videotapes are old and inaccessible due to their outdated format, and are in critical need of preservation measures. The recordings will be made widely available to tribal members, educators, scholars, and the public, and specific steps will be taken to facilitate the use of Celebration content as educational tools by K-12 teachers and university instructors. These efforts will provide for the preservation and accessibility of a significant cultural collection, foster greater understanding of tribal values and traditions, and promote cross-cultural education.",0,"Sealaska Corporation",2015,"Native American Library Services: Enhancement Grants",$147959,"Office of Library Services",Juneau,AK
NG-03-15-0032-15,"The Nisqually Tribe will utilize a StoryCorps recording studio within the tribal library to record the stories of tribal members.  Trained staff will use the recording technology to facilitate sessions where tribal members exchange and share their stories with each other. These recordings will then become part of the knowledge the tribe can share from the tribal Library's collection and will be preserved for future generations.",0,"Nisqually Indian Tribe",2015,"Native American Library Services: Enhancement Grants",$40492,"Office of Library Services",Olympia,WA
NG-03-15-0013-15,"With this award, the Yakama Nation will revive the existing outdated library collection with relevant new books, and audio and video resources. The library staff will focus on professional development in cataloging, reading literacy, and collection development in order to facilitate, support, and assist patrons in meeting their information retrieval needs. The library will also collaborate with the Yakama Nation Tribal School to select readings to enhance student project-based learning research needs. The Yakama Nation envisions building upon their collaborative success by updating the library collection and promoting reading. These developments will enhance library programming, promote reading, and generate enthusiasm for reading at Head Start facilities and at library story hours.",0,"Confederated Tribes and Bands of the Yakama Nation",2015,"Native American Library Services: Enhancement Grants",$146864,"Office of Library Services",Toppenish,WA
NG-03-15-0036-15,"The Chilkat Indian Village Library designed a program that will focus on Tlingit culture, tribal history, and impacts of library and cultural services with the goal of increasing community knowledge of tribal cultural history, media literacy, and life and career skills. The library will present programs, develop collections, provide increased access to cultural resources, and create five films that record tribal lands history. Project staff will work with mentors to build skills and will develop an evaluation tool that spans a decade of services. They will analyze long-term impacts of cultural and library services that have been provided in order to better understand how to design effective programs and services in the future. The overarching goal is to promote the library as a strong community anchor that will enhance civic engagement, cultural opportunities, and economic vitality for tribal members, researchers, others who use library services or view the films, tribal council, and the village.",0,"Chilkat Indian Village",2015,"Native American Library Services: Enhancement Grants",$149998,"Office of Library Services",Haines,AK
NG-03-15-0025-15,"The Bay Mills Community College Library has two main goals for this project: to introduce area children (from infants to teens) to more literature, and to increase the public's awareness of the library as a community center where all ages feel welcome. It will be partnering with two local schools and one childcare center in order to accomplish these goals. This multi-faceted approach will include the following activities: book giveaways, youth book clubs, scheduled visits to the library, lessons at the public school library, family reading events, and community open houses. New books and technology will be purchased for classrooms, the local school library, and the Library's own children's collection so that the library will be able to offer area children larger, updated collections.",0,"Bay Mills Indian Community",2015,"Native American Library Services: Enhancement Grants",$51863,"Office of Library Services",Brimley,MI
NG-03-15-0021-15,"Iowa Tribe of Oklahoma will inventory and digitize more than 1,500 documents and photos in the Tribal Archive Room. Many of these irreplaceable documents are more than 100 years old and the majority could be permanently lost. Along with digitizing these historical documents, the tribe will collect personal stories, and display these stories and photographs in the tribal community center. The tribe plans to establish a Gathering Family History area in the tribal library where members can come to have their photos, letters, and out-of-copyright books scanned and reproduced digitally, and added to the collection.",0,"Iowa Tribe of Oklahoma",2015,"Native American Library Services: Enhancement Grants",$149991,"Office of Library Services",Perkins,OK
