"Log Number",Description,"Supplement Indicator",Institution,"Fiscal Year",Program,"Federal Funds","Funding Office",City,State
NAE-254945-OLS-23,"The Wyandotte Nations’ Project BEAR (Books Everywhere to Advance Reading) will expand access to the Wyandotte Nation Library’s services and strengthen community and civic engagement through facilitating a story walk project, Reading Buddies program, and outdoor movie events. The library will purchase a laminator, book covers and book pages, and solar lights for revolving story walks in Bear Park, promoting a connection with nature and offering health benefits. The Reading Buddies program will pair older and younger students to read Sequoyah books together. Additionally, the library will host outdoor movie events based upon a book, season, or native theme to foster community interaction. The project will benefit the 1,819 tribal citizens within their project service area in northeastern Oklahoma.",0,"Wyandotte Nation",2023,"Native American Library Services: Enhancement Grants",$106218,"Office of Library Services",Wyandotte,OK
NAE-254972-OLS-23,"The North Fork Rancheria of Mono Indians of California's Tribal Library staff will address collection care and management by expanding their collection storage and cataloging both the printed and historical research collection into their online library. For example, grant funds will allow staff to work with representatives from the California Historical Society as well as from the Fresno County Historical Society to research and obtain historical accounts, records and published historic records to include in their library. Staff will also launch outreach efforts and issue library cards to encourage tribal citizens to participate in library learning programs, and ensure their access to the current collections. Staff will continue to work on increasing the literacy skills of family members in the community by providing them with access to not only published material, but historical records and firsthand accounts. This includes sharing historical family information so that families have the ability to create a family tree or learn more about their tribal history.",0,"Northfork Rancheria Mono Indians",2023,"Native American Library Services: Enhancement Grants",$115181,"Office of Library Services","North Fork",CA
NAE-254974-OLS-23,"Sealaska Heritage Institute’s “Tlingit Macbeth: Celebrating Indigenous Films project” will allow staff to edit raw footage of the 2007 performance of the play (performed by an all-Native cast and primarily in the Tlingit language), into a feature film to be premiered at Celebration 2024 as the main feature of a Film Festival, then made available to the public on DVD. The project will celebrate and share the unique contributions made by members of the Alaska Native community that worked so hard to create Tlingit Macbeth, and also honor their memory, such as the translator Johnny Marks who has since ‘Walked into the Forest.’ The project will also debut a Juried Film Show component at the Festival, which will highlight Native filmmakers where the winning short films will be presented with an award ceremony. “Tlingit Macbeth: Celebrating Indigenous Films” will address the need for representation of Alaska Native characters, cultures, and languages in contemporary media, but also Alaska Native representation of directors and filmmakers.",0,"Sealaska Corporation",2023,"Native American Library Services: Enhancement Grants",$115083,"Office of Library Services",Juneau,AK
NAE-254954-OLS-23,"The Chilkat Indian Village’s “Reclaiming and Sustaining Our Traditional Knowledge” project will increase culturally relevant and place-based resources and learning opportunities for library patrons by supporting the continuation of haa kustiyee, ‘our way of life’. Project activities include hosting Northwest Coast Arts workshops to increase learning opportunities, filming eight traditional skills demonstrations to expand community-developed resources, as well as facilitating and filming eight panel discussions on special topics relevant to the culture and history of the Chilkat Valley to be accessed by tribal members, Chilkat Valley residents, researchers, and future generations. The produced film content will expand the library’s reach by increasing the opportunities for asynchronous learning, and will be available at the library with physical DVD copies and online streaming access via the Klukwan Digital Archives.",0,"Chilkat Indian Village",2023,"Native American Library Services: Enhancement Grants",$149931,"Office of Library Services",Haines,AK
NAE-254963-OLS-23,"The Ak-Chin Indian Community (ACIC) library in Maricopa, Arizona, will create a year-round reading tutoring program, fulfilling a key community need, as there currently are no established reading tutoring programs within the Ak-Chin Indian Community. Grant funds will also be used to purchase a passenger van to transport students to and from the library. This will enable core library users of children 10 years and under to participate in library programs because although ACIC has a tribal transit service, they cannot ride alone on the transit bus. Funds will support salaries for Reading Tutors, who will facilitate a Buddy’s Reading Circle program focused on teaching phonemic awareness, phonics, fluency, vocabulary, and comprehension, including assessments of the student’s reading levels. Funds will also support purchasing books for the library. The project will benefit Ak-Chin Indian Community students in grades first through fifth grade and their families.",0,"Ak-Chin Indian Community",2023,"Native American Library Services: Enhancement Grants",$150000,"Office of Library Services",Maricopa,AZ
NAE-254966-OLS-23,"The Bad River Band of Lake Superior Tribe of Chippewa Indians in Odanah, Wisconsin will provide educational opportunities including a K-5 summer reading challenge, and teen and adult book and writing clubs to enhance literacy skills. The project was shaped by a needs survey conducted and led by the Tribe's Education Director and Library Coordinator. Grant funds will support full-time hours for the Library Coordinator which is essential for implementing programs. Grant funds will support travel for Indigenous author visits for readings at the library. The project will also fund a Summer Reading program, including art and outdoor activities related to children’s books. The project will benefit the Bad River Band Tribal community, particularly youth (grades K-5) and young adults.",0,"Bad River Band of Lake Superior Tribe of Chippewa Indians",2023,"Native American Library Services: Enhancement Grants",$149755,"Office of Library Services",Odanah,WI
NAE-254950-OLS-23,"The Kickapoo Tribe of Oklahoma’s (KTO) “Kickapoo Language and Culture Project” will preserve and promote their cultural and linguistic literacy by increasing the number of language and cultural classes held in the library, as well as providing patrons with access to various language resources, government documents, books, music, CDs, and cassettes. Project activities include preserving and digitizing their people's historical and ethnographic records Grant funds will support and enhance the All Nations Youth Council after-school programs, and summer youth language and cultural programs to strengthen literacy skills within the community. Funds will also be used towards creating a digital media Kickapoo portal and curriculum for education and literacy workshops for the community members.",0,"Kickapoo Tribe of Oklahoma",2023,"Native American Library Services: Enhancement Grants",$150000,"Office of Library Services",McLoud,OK
NAE-254948-OLS-23,"The Chippewa Cree Tribe of The Rocky Boy Reservation will improve access to the Stone Child College/Rocky Boy Community Library’s resources and promote preservation of the Chippewa Cree culture. Notably, the Rocky Boy’s Indian Reservation is the only reservation in the United States that speaks Cree. The project was informed by strategic planning and community survey responses to improve the library’s services. The grant will support twelve community events, with topics such as typing and writing in Cree, storytelling, native plants of Rocky Boy. Additionally, two one-day workshops with local artists and craftsmen on two of the following topics will be offered: ribbon shirts/ribbon skirts, crockpot meals, painting workshop, dry meat making, or a historical tour of Rocky Boy. Grant funds will support the purchase of archival supplies, periodicals, and subscriptions. The grant will also support Lyrasis DSpaceDirect Hosting Platform renewal to store digital archived items. The project will benefit the community members of the Rocky Boy Indian Reservation.",0,"Chippewa Cree Tribe",2023,"Native American Library Services: Enhancement Grants",$106548,"Office of Library Services","Box Elder",MT
NAE-254969-OLS-23,"The Nez Perce Tribe will use grant funds to support the library director position for their new “Hite’emenwees”, Nez Perce Tribe Reading and Research Library, which will enable expanded outreach efforts to inform the reservation communities and public at large. There is a recognized need to expand outreach to the other two cities on the Nez Perce Reservation with the highest Native American populations, in order to inform residents of those communities about the new library and to encourage their patronage. Funds will also be used towards adding collection materials for reading and research, obtaining iPads for patron checkout, and establishing monthly community programs in order to increase public interest and support for the library while fostering multicultural engagement and learning.",0,"Nez Perce Tribe",2023,"Native American Library Services: Enhancement Grants",$108272,"Office of Library Services",Lapwai,ID
NAE-254946-OLS-23,"The Sisseton-Wahpeton Oyate (people) of the Lake Traverse Reservation’s Sisseton Wahpeton College (SWC) Wowapi Opahi Oyanke (WOO) Public Library & Archives will build community through the enhancement of their library staff via hands-on training in research methodology, the implementation of cultural programming with culture & language fun night, the acquisition of new materials, and monthly health awareness promotions. Grant funds will not only increase capacity for the future growth of the library but will maintain library community programming services and improve assessment of its growth as well. Funds will also be used towards the hiring of a new librarian and the training of WOO staff in the day-to-day programming and operations of a community library. Funds will cultivate youth interest in the language and culture of the Sisseton Wahpeton Oyate in connecting elders with student learner and apprentices via monthly Dakota Iapi Voices of Our Ancestors (VOA) programming.",0,"Sisseton-Wahpeton Oyate",2023,"Native American Library Services: Enhancement Grants",$149880,"Office of Library Services","Agency Village",SD
NAE-254958-OLS-23,"The Saint Regis Mohawk Tribe (SRMT), in partnership with its Tribal Courts, Akwesasne Library, Tribal Clerk, General Counsel’s Office, Education Division, Kanien’keha Language Program, and the Tribal Historic Preservation Office and Records Department will contract with Open Law Library to create a digital law library to improve access to SRMT tribal laws. The project includes creating a satellite law library at the SRMT Tribal Courts for use by Judges, Court Personnel, and litigants. Funds will also provide legal research training to the Akwesasne Library staff so they can assist the public, including self-represented litigants. Additionally, kiosks will be installed for use by those without internet to access digital legal materials. The project will benefit the SRMT tribal government and Akwesasne community members.",0,"Saint Regis Mohawk Tribe",2023,"Native American Library Services: Enhancement Grants",$149987,"Office of Library Services",Akwesasne,NY
NAE-254968-OLS-23,"The Northwestern Band of the Shoshone Nation will expand and rebuild their physical library space through design, supplies, and program development as well as provide more language and culture-based activities for families in the community. Grants funds will be used to purchase seating and shelving, desks, tables, chairs, and moveable walls. Funds will allow staff to build upon current language and culture revitalization efforts through providing more in-person Shoshone language teaching and Shoshone Storybook making activities. Grant funds will also be used towards re-cataloguing/updating their electronic catalogue, as well as resource development. Efforts will be made to display traditional Shoshone interpretive materials such as baskets, beadwork, and other tools and items in order to further Shoshone cultural education.",0,"Northwestern Band of the Shoshone Nation",2023,"Native American Library Services: Enhancement Grants",$61068,"Office of Library Services","Brigham City",UT
NAE-254961-OLS-23,"The Quinault Indian Nation will develop a Quinault language vocabulary builder application in partnership with The Language Conservancy. The project will revitalize the Quinault language through offering access to a mobile, free language learning tool. Importantly, the application can be used with or without internet connection after it has been downloaded, enabling language learners in rural areas without reliable internet to use this language resource. The application will feature a pronunciation guide so that users can learn Quinault pronunciations as well as how to read Quinault orthography. Funds will also support a release event including demonstrations on using the application and participants will be surveyed following the event to gauge effectiveness. The project will benefit the more than 3,470 members of the Quinault Indian Nation.",0,"Quinault Indian Nation",2023,"Native American Library Services: Enhancement Grants",$92272,"Office of Library Services",Taholah,WA
NAE-254979-OLS-23,"The Ahtna Language and Cultural Department of Chickaloon Native Village “Ahtna Dene Nekenaege’ Tene’ (Our Ahtna Language Path) Project” will utilize grants funds to create a new self-hosted searchable database of 500+ hours of Ahtna Dene language recordings, as well as the creation of educational literacy learning materials such as linguistic lessons with accompanying digital audio and video recordings, to be hosted on a website for use by the public. These audio recordings require cataloging and uploading into a web-interfaced platform for ease of use by those wanting to focus on Ahtna language learning. The platform will allow for lesson plan(s) to be added over time, and ensure the preservation of Ahtna language and encourage learning within the home environment and in perpetuity. The platform will also be beneficial to those wishing to do comparison linguistic research among the 11 distinct Athabascan ethnolinguistic groups.",0,"Chickaloon Native Village",2023,"Native American Library Services: Enhancement Grants",$147529,"Office of Library Services",Palmer,AK
NAE-254947-OLS-23,"The Forest County Potowatomi Community (FCPC) will use grant funds to increase its library resources, broaden community engagement activities through multiple partnerships, and expand their youth programming. Grant funds will support the Assistant Librarian position at their Cultural Center, Library & Museum to re-establish the relationship between the library and the community, as well as library programming after initial termination of the role due to the COVID-19 pandemic. Funds will also be used to increase the collection of books, DVD's and CD's pertaining to American Indian History, culture and all fields within the realm of American Indian Studies and literature for Tribal Nations in the Americas. Youth programming will also be expanded beyond the current Pre-K to reach students at all grade levels as the Tribe and the local schools begin efforts to increase knowledge of Potowatomi language, history and culture.",0,"Forest County Potawatomi Community",2023,"Native American Library Services: Enhancement Grants",$150000,"Office of Library Services",Crandon,WI
NAE-254959-OLS-23,"The La Jolla Band of Luiseno Indians will strengthen the educational component of the La Jolla Generations Program’s work. The La Jolla Generations Program provides an encouraging atmosphere for area youth to enhance their knowledge and respect of culture, health, and academics.  Grant funds will support staff salaries for Program Aides, who are former students of the La Jolla Generations Program. The Program Aides will plan daily activities related to culture, science, math and literature, and coordinate community events. Funding will also support purchasing classroom supplies, new library books, literacy games, and reading incentives. Additionally, a tutor for Language Arts and Math will provide help to students. Grant funds will support tuition assistance and stipends for college and trade school students. The project will provide a direct benefit to the Jolla Band of Luiseño Indians and members of the Pauma Valley community.",0,"La Jolla Band of Luiseño Indians",2023,"Native American Library Services: Enhancement Grants",$121220,"Office of Library Services","Pauma Valley",CA
NAE-254978-OLS-23,"The Fort Independence Indian Community will partner with the Owens Valley Unified School District and the Eastern California Museum to promote literacy skills, educational resources, and culturally influential activities in their rural Inyo County California community. Project activities include administering surveys to evaluate the educational needs of the community. Additionally, they will implement a read aloud program for children in K-5 grades at the Tribe’s Nuumu Library to enhance reading literacy. The Tribe will develop an after-school program for children in grades 6-12 to provide resources including access to a computer lab and cultural educational activities. The Tribe will collaborate with The Eastern California Museum to bring Indigenous awareness and cultural enrichment workshops to preserve the Paiute language. The project will benefit the community on the Reservation, the Owens Valley Unified School District, and the Eastern California Museum",0,"Fort Independence Indian Reservation",2023,"Native American Library Services: Enhancement Grants",$150000,"Office of Library Services",Independence,CA
NAE-254952-OLS-23,"The Catawba Indian Nation’s project will upgrade material artifact storage for the Catawba Nation Archives' (CNA) through the purchase & installation of five museum-grade storage cabinets for their collection of Catawba pottery, basketry, and other material artifacts. Grant funds will also support professional digitization of Catawba language materials currently only available on microfilm; oral histories on obsolete media such as digital audio tapes (DAT); and, microcassettes, as well as still images only available as 35mm slides. This project will allow pottery and other material artifacts to be more easily accessible while providing safe and preservative storage, and make rare linguistic materials, oral histories, and images more widely and easily accessible via the Catawba Nation Archives Online (archives.catawbaculture.org).",0,"Catawba Indian Nation",2023,"Native American Library Services: Enhancement Grants",$145000,"Office of Library Services","Rock Hill",SC
NAE-254977-OLS-23,"The Cachil Dehe Band of Wintun Indians of the Colusa Indian Community Council will utilize grant funds to provide teaching workshop opportunities for community members to improve or learn video taking, video editing and audio editing skills, as well as to create and publish audio and visual stories presented in their Native Language, and discuss important cultural topics via language podcasts. A cookbook that records recipes and traditional native ingredients used by tribal members, and a coloring book where each member can contribute art, will be created using communal participation to be distributed to all households and available at the library. These efforts support the movement to revitalize the conversation, depiction, and culmination of the Cachil Dehe Band of Wintun Indians' culture.",0,"Cachil Dehe Band of Wintun Indians",2023,"Native American Library Services: Enhancement Grants",$150000,"Office of Library Services",Colusa,CA
NAE-254971-OLS-23,"Ginanda Gikendaasomin Library, located in remote northern Wisconsin, will support the growth of Red Cliff language and culture as well as community members’ personal aspirations related to educational and employment goals. A key project goal is to support the growth of Ojibwemowin (Ojibwe language) and cultural teachings in Red Cliff. Grant funds will support increased staff hours and programming, including an annual fall College and Career fair, a Business and Career Symposium, featuring workshops related to starting a new business, business planning, job-seeking, and locating resources for childcare. Additional grant funded activities include Back to Basics Native Culture, Book Club, Arts and Crafts Niche, advanced game nights, films and digital club, health and wellness events, and traditional music sessions. The project will benefit all 1,353 tribal members living in Red Cliff and those living nearby, with a special focus on young adults aged 18-35.",0,"Red Cliff Band of Lake Superior Chippewa",2023,"Native American Library Services: Enhancement Grants",$150000,"Office of Library Services",Bayfield,WI
NAE-254980-OLS-23,"The Big Valley Band of Pomo Indians of the Big Valley Rancheria will engage tribal members in hands-on, intergenerational learning experiences focused on tribal history, culture, and preservation, improving core library services for the community. Grant funds will support purchasing glass-fronted bookshelves, and shelving units to house and exhibit Tribal cultural and historical collections that have never been displayed before, including maps, baskets, fishing weights, shaping and drilling tools, soaproot, and ceremonial regalia. Grant funds will also support live cultural demonstrations such as traditional fish-traps, baskets, and games; acorn processing, elderberry tonics and other traditional medicines, accompanied by Eastern Pomo language lessons. They will create in-house Eastern Pomo publications for Tribal youth to co-author and illustrate bilingual booklets in English and Eastern Pomo. The project will benefit all tribal members and Lake County residents.",0,"Big Valley Band of Pomo Indians",2023,"Native American Library Services: Enhancement Grants",$87846,"Office of Library Services",Lakeport,CA
NAE-254975-OLS-23,"The Tangirnaq Native Village of the Kodiak Area Native Association will utilize grant funds to purchase materials, culturally relevant literature and publications for their library collection, deploy an outreach campaign to Tribal citizens residing both locally and outside Kodiak to increase usage of the library and website, as well as collaborate with the Pacific Northwest Alutiiq Culture Camp (PNWACC) and other experts to develop culturally relevant language learning resources and educational materials. These will be delivered to the public through multimedia activities and at least 4 virtual education sessions per year. These efforts continue to support Alutiiq language and Tangirnarmiut cultural revitalization movement which includes cultural activities, education and initiatives, as well as the revitalization of arts and Alutiiq language on Kodiak Island.",0,"Kodiak Area Native Association",2023,"Native American Library Services: Enhancement Grants",$150000,"Office of Library Services",Kodiak,AK
NAE-254951-OLS-23,"The Kaw Nation will promote community access to the Kanza Library and Learning Center’s many resources and services through increased staff, hours, and programming. The library will provide a parent/teacher resource section for the Shidler/Kaw City School District. An afterschool program and tutor will assist students with homework and career planning. A Native Book Club will be open to the public with guest authors, specialized events and cultural cooking classes, beadwork, gardening and photography opportunities. The library will install an interactive digital kiosk featuring Tribal Language and hands on learning activities Additionally, language classes will be taught in the Learning Center to increase tribal language literacy. A StoryWalk featuring interchangeable children’s stories, tribal culture and history facts will be installed on the walking trail behind the library. Funds will also provide support for staff to travel for training at professional conferences. The project will benefit the rural citizens of Kay County and surrounding communities.",0,"Kaw Nation",2023,"Native American Library Services: Enhancement Grants",$149969,"Office of Library Services","Kaw City",OK
