"Log Number",Description,"Supplement Indicator",Institution,"Fiscal Year",Program,"Federal Funds","Funding Office",City,State
NG-03-11-0259-11,"The Washoe Tribe of Nevada and California intends to develop the full potential of its Woodfords Community Library in response to community feedback requesting more library staff, evening and weekend hours, organized family activities, and relevant materials to draw on for increased cultural programming. New youth activities will include read-a-thons, preschool story time with a focus on pre literacy skills, pillows and PJ's movie nights, a creative writing club, and digital literacy classes in their new computer center. New eReaders and eBooks will enhance the digital experience for everyone, while the library will host book clubs and a cultural lecture series for adults. It will offer a program series of traditional Washoe seasonal cultural activities, expressed through language, art, stories, crafts, and songs appropriate for each season, culminating in a summer cultural fair with the theme “Celebrate Our Roots.”",0,"Washoe Tribe of Nevada & California",2011,"Native American Library Services: Enhancement Grants",$149411,"Office of Library Services",Gardnerville,NV
NG-03-11-0231-11,"The Pueblo of Acoma will develop the Acoma Historical Storytelling Project, led by the Pueblo’s Learning Center and Library. It will engage youth, senior citizens, and families in a book publishing project through traditional and contemporary storytelling that will result in the production of two books on Acoma's history. In partnership with the Sky City Community School, Behavioral Health Services, Acoma Senior Center, other tribal programs, as well as the University of New Mexico Indigenous Nations Library Program, tribal members will learn 21st century skills such as the use of software applications, desk-top publishing, videography, digital formats, and research using digital resources. The project is based on a recent needs assessment in which the community indicated it wanted training in software applications, cultural and family activities, increased library resources, and opportunities to volunteer with culturally-based projects.",0,"Pueble of Acoma",2011,"Native American Library Services: Enhancement Grants",$95149,"Office of Library Services","Pueblo of Acoma",NM
NG-03-11-0245-11,"The Petersburg Indian Association and the Petersburg Public Library will jointly implement the Many Voices, One Community project with programming on topics such as preparation of traditional foods and medicines, subsistence methods, Northwest Coast art and design, and Tlingit language and history. Cultural content will also be incorporated into regular library programs such as the Summer Reading Challenge, story times, and K-grade 5 after-school programs. Facilitated community dialogues will provide a structured, neutral forum for community members to share their ideas and discuss solutions to issues facing the community as a whole. Oral histories of elders and tribal members will be recorded, digitized, and made available online. Materials related to Tlingit culture will be added to the Library's collection and support the programs offered.",0,"Petersburg Indian Association",2011,"Native American Library Services: Enhancement Grants",$149681,"Office of Library Services",Petersburg,AK
NG-03-11-0224-11,"The Saginaw Chippewa Indian Tribe of Michigan plans to transform its tribal library into a place where families play and learn together. An engaging children’s area with a birchbark reading house, new books, educational toys, musical instruments, and early literacy stations will be the centerpiece for activities under their Prime Time Family Reading Time® program. A teen space will be created to draw in more youth looking for an inviting place to spend time. Providing eReaders and shared subscriptions to eResources, the library will usher in a new level of access to patrons on- and off-site as a member of the Mideastern Michigan Library Cooperative Digital Consortium.",0,"Saginaw Chippewa Indian Tribe",2011,"Native American Library Services: Enhancement Grants",$81719,"Office of Library Services","Mount Pleasant",MI
NG-03-11-0258-11,"The Squaxin Island Tribe will initiate the Squaxin Legends and Storytelling Project as a youth engagement and storytelling documentation project that will take place at the Squaxin Island Museum Library and Research Center (MLRC). The project will build cultural awareness for Squaxin youth directly involved in the project as they listen to traditional stories and learn to use technological skills to express their new knowledge. Each participant will create a personal book in electronic or paper format. Storytelling sessions will be captured on video, resulting in over 80 hours of raw documentation of traditional stories. The project will preserve Squaxin traditional cultural expressions in a way that can be added to the permanent library collections and shared with others.",0,"Squaxin Island Tribe",2011,"Native American Library Services: Enhancement Grants",$103786,"Office of Library Services",Shelton,WA
NG-03-11-0228-11,"The Chilkoot Indian Association, in partnership with the Haines Borough Public Library, will develop a Chilkat Valley Storyboard using the Microsoft Surface® platform. The electronic interactive exhibit will share Tlingit place names, Tlingit language, and stories of local and natural history with the local community and visitors from afar. Elders, youth and technical consultants will work together to plan the exhibit, gather information and develop the Storyboard using photos, film, sound, historical documents, and text. A second component of the project will focus on intercultural communication skills that will encourage all community members to engage in respectful discussions using strategies such as ""Human Library"" programs, providing ""people on loan"" who vary in age, expertise, and cultural background to strengthen cooperation and understanding within the community.",0,"Chilkoot Indian Association",2011,"Native American Library Services: Enhancement Grants",$135696,"Office of Library Services",Haines,AK
NG-03-11-0226-11,"The Sealaska Heritage Institute, on behalf of Sealaska Corporation, will increase access to its valuable “hidden collections” by focusing on 137 Tlingit language recordings that contain Tlingit oral histories and traditional ecological knowledge. An intern from the University of Alaska Southeast will migrate the cassette tapes according to Library of Congress National Recording Preservation Board standards, then native Tlingit speakers will review the digital copies and record relevant metadata. This information will be added to the Institute’s records and then uploaded to be shared through the international Open Language Archives Community (OLAC). The University of Alaska Fairbanks Alaska Native Language Archive has agreed to deposit copies of their Tlingit, Haida, and Tsimshian recordings with the Institute, further opening those collections over time as native speakers continue to provide crucial metadata for these materials.",0,"Sealaska Corporation",2011,"Native American Library Services: Enhancement Grants",$149935,"Office of Library Services",Juneau,AK
NG-03-11-0229-11,"The Nisqually Tribe will expand its children’s library services beyond the walls of the newly refurbished tribal library to include the isolated reservation and allotment land communities, where tribal youth have difficulty visiting the library. The tribe will offer bookmobile services on a weekly basis to a variety of tribal facilities, providing year round children’s services with a tribal member serving as a Youth Services coordinator. The library will partner with the Nisqually Day Care Center, Head Start program, the Youth Center, and the Timberland Regional Library (TRL), providing children's programming and an expanded children's collection. Part of the main collection will circulate through the bookmobile as well, expanding the reach of the rich Native American collection at the tribal library, and access to the TRL collection through a resource delivery partnership already in existence will be actively promoted.",0,"Nisqually Indian Tribe",2011,"Native American Library Services: Enhancement Grants",$149604,"Office of Library Services",Olympia,WA
NG-03-11-0260-11,"In response to a community survey, the Shingle Springs Band of Miwok Indians will transform their library into an inviting space for children and adults with culturally-relevant programming and a focused collection about Native American culture and the Native American experience. They will hire a new assistant librarian to expand the library’s currently limited hours of service and to coordinate a series of cultural activities, including a Native storytelling program and basketry classes for children and adults, with the goal of creating the library as a hub of cultural activities that all community members will call their own.",0,"Shingle Springs Band Of Miwok Indians",2011,"Native American Library Services: Enhancement Grants",$133859,"Office of Library Services",Placerville,CA
NG-03-10-0237-10,"The Bay Mills Indian Community of Brimley, MI, will be focusing on two high-priority needs with this grant. The first will be to document traditional knowledge and language for future generations. A videographer will record the Bay Mills Community College’s Ojibwe Language Immersion classes as well as oral history interviews with tribal elders, cultural events, and workshops. This material will be available on a computer kiosk at the community library on the Bay Mills Community College campus as well as on the Internet and in DVD format. The second priority is to establish a branch library at the Brimley Area Public School. When local budget cuts left the school without a librarian, volunteers stepped in. With this grant, the Bay Mills Indian Community has agreed to provide staffing for the Brimley School library so that students can receive quality library services so important to their academic success.",0,"Bay Mills Indian Community",2010,"Native American Library Services: Enhancement Grants",$147968,"Office of Library Services",Brimley,MI
NG-03-10-0258-10,"On behalf of the Lummi Tribe, the Lummi Library at Northwest Indian College in Bellingham, WA, will implement an early literacy project titled “The Lummi Road to Reading.” This will leverage proven methods for improving early childhood literacy through its alignment with the Raising A Reader® program, the Early Childhood Education program at Northwest Indian College (NWIC), Lummi Head Start, and Lummi Daycare. A literacy coordinator and NWIC interns will be hired to provide programming and training. The target audience is Lummi community families with children ages birth through five. The library seeks to be a catalyst for addressing literacy at its earliest stages of development, and to be a proactive agent in collaborating with other Lummi community organizations to help foster the best possible foundation for early childhood literacy.",0,"Lummi Nation",2010,"Native American Library Services: Enhancement Grants",$148580,"Office of Library Services",Bellingham,WA
NG-03-10-0229-10,"The Picayune Rancheria of Chukchansi Indians in Coarsegold, CA, will implement the Chukchansi Family Library Services Program, which will focus on three specific areas of need identified in a recent community survey. Cultural Discovery will involve intergenerational activities with elders and youths, incorporating traditional teachings, oral histories, and traditional arts. Cultural Literacy will introduce culturally relevant reading activities based on materials created by community members in English and Chukchansi. And Computer Knowledge will address computer technology and education for adults by offering mini-courses that will enhance computer skills necessary for job success.",0,"Picayune Rancheria of the Chukchansi Indians",2010,"Native American Library Services: Enhancement Grants",$148655,"Office of Library Services",Coarsegold,CA
NG-03-10-0224-10,"The Cherokee Nation, based in Tahlequah, OK, will establish the Virtual Library of Cherokee Knowledge, which is designed to provide Cherokee citizens and the general public access to a comprehensive digital repository of authentic Cherokee knowledge related to the nation's history, language, traditions, culture, and leaders. This endeavor will enable the tribe to secure professional consultation services from digital library specialists, historians, and museum and library professionals and to obtain the technology, software, and equipment necessary for scanning, digitizing, and cataloguing many of the tribe's most significant documents. The Virtual Library will serve as a source for educational programming to promote cultural literacy among tribal members.",0,"Cherokee Nation",2010,"Native American Library Services: Enhancement Grants",$150000,"Office of Library Services",Tahlequah,OK
NG-03-10-0223-10,"On behalf of the Leech Lake Band of the Minnesota Chippewa Tribe, the Bug-O-Nay-Ge-Shig School in Bena, MN, will implement the Library Services Opportunity and Renovation Project to better serve students and surrounding communities. While adding extensive collection materials for all ages, the school library will also be made available to community members after school and during special events. A new library assistant will help with processing new materials and helping community members learn how to use the library’s resources. New computers in the library and a portable computer lab of 18 laptops will greatly expand technology access in the school, while new furnishings will create a friendly, inviting atmosphere.",0,"Minnesota Chippewa Tribe/Leech Lake Band",2010,"Native American Library Services: Enhancement Grants",$149936,"Office of Library Services","Cass Lake",MN
NG-03-10-0250-10,"The Makah Culture and Research Center, on behalf of the Makah Indian Tribe of Neah Bay, WA, will offer a program titled “Makahs: In Pursuit of Knowledge (MIPOK),” which will build on its earlier Enhancement Grant project “We Are All Family.” The “Family” project has increased the Center’s resources with photographs and textual records donated by community members during their genealogical workshops. It became apparent during these workshops that participants wanted and needed more assistance with digitizing their private collections since many did not have computers, scanners, software, or the knowledge to use these tools. As a result, the MIPOK Project will offer ten computer workshops to help patrons develop new skills in managing and manipulating their own digital files. To further enhance Makah cultural resources at the Center, staff will produce oral histories of 15 Makah elders and their perspectives on Makah history, technology, and culture. A Makah History Lecture Series with bilingual presentations by the tribal historian will be developed for the community as well.",0,"Makah Indian Tribe",2010,"Native American Library Services: Enhancement Grants",$48377,"Office of Library Services","Neah Bay",WA
NG-03-10-0240-10,"Ohkay Owingeh, in New Mexico, will enhance its existing P’oe Tsawa Community Library services and activities for library patrons of all ages, particularly preschoolers, students, parents, caregivers, and educators, by strengthening their current literacy programs by adding storytelling events and initiating a ""Newborn to Pre-school Literacy Program” based on Every Child Ready to Read @ your library.®   A Literacy Program Assistant will be responsible for literacy programming , extensive outreach to the community, and extended hours at the library for easier community access.",0,"Ohkay Owingeh Tribal Council",2010,"Native American Library Services: Enhancement Grants",$83930,"Office of Library Services","Ohkay Owingeh",NM
NG-03-10-0241-10,"On behalf of Spirit Lake Tribe, the Valerie Merrick Memorial Library at the Cankdeska Cikana Community College in Fort Totten, ND, will build a community literacy program. The program will focus on improving reading skills through an outreach campaign that will emphasize family literacy activities during library family reading nights; weekly story hour for the college childcare center; summer reading camps; Books for Babes for every new baby screened at Early Childhood Tracking; and Parent Getaway Nights, which will provide literacy activities and build family reading skills during a parents-only night. Leapfrog® learning aids will be used in library activities and will be available for check-out by families for home use. Project partners include Cankdeska Cikana Community College (CCCC) Childcare Center, CCCC Early Childhood Education, Four Winds Community School, Spirit Lake Head Start, and Early Childhood Tracking.",0,"Spirit Lake Nation",2010,"Native American Library Services: Enhancement Grants",$116749,"Office of Library Services","Fort Totten",ND
NG-03-10-0252-10,"The Karuk Tribe of California is initiating a project titled “Promoting Karuk Life: Capturing Our Culture,” which will improve and expand on existing library operations in Happy Camp and Orleans, CA. With the assistance of a consultant, library staff will organize and catalog their collections and make them Web-accessible. Local storytellers will entertain Karuk Head Start children and introduce them to the library environment. Trainings and workshops on how to use the library’s resources will be held for adults at the Karuk Tribe Community Computer Centers. And, in conjunction with the Karuk Language Program Coordinator, project staff will add more culturally relevant and culturally appropriate materials to the collections, with a particular focus on Karuk language materials, which will be acquired, cataloged, and converted to digital files for online access.",0,"Karuk Tribe",2010,"Native American Library Services: Enhancement Grants",$145165,"Office of Library Services","Happy Camp",CA
NG-03-10-0246-10,"Igiugig Village, located in southwestern Alaska on the shore of Lake Iliamna, maintains an active joint school-public library, which will utilize this grant to gather local knowledge, oral history, and elder recollections of the community. Material collected will be the basis for a digitization project of historic photos, other images, and stories related to the early history of the village. It will fulfill the need for a published history of Igiugig Village with the assistance of native elders who can tell the story firsthand. The library staff will purchase digitization equipment and receive training on digital projects from an experienced librarian who created a similar digital archive and storytelling project in another rural Alaska village. They will also learn and follow appropriate protocol to safely archive the collected information and to record, preserve and disseminate these materials.",0,"Igiugig Village",2010,"Native American Library Services: Enhancement Grants",$118220,"Office of Library Services",Igiugig,AK
NG-03-10-0242-10,"The Oneida Community Public Libraries, on behalf of the Oneida Nation of Wisconsin, are planning a library makeover with new furnishings to provide a comfortable, safe, and inviting environment for the community. In addition, new computers, a white board for Oneida culture and language classes, a Nintendo Wii for fitness and educational gaming, and video equipment will help bridge the digital divide for staff and patrons. An Oneida artist and videographer will develop a Teen Video Project with the Youth Liaison hired under this grant. Final videos will be voted on by community members for an awards ceremony honoring all participants. The Green Earth Branch Library will organize a mini-autobiography scrapbooking project for their Elder Day activities and will host Elder Story Time during which this work will be showcased.",0,"Oneida Nation",2010,"Native American Library Services: Enhancement Grants",$102824,"Office of Library Services","Green Bay",WI
NG-03-10-0253-10,"The project, Aabiji-Miinidiiwin or “Endless Gift,” planned by Keweenaw Bay Indian Community, Michigan, is a cooperative effort between the Keweenaw Bay Tribal Education Department, Ojibwa Community Library, the Head Start/Early Head Start Program, and the Pre-Primary Education Center that will focus on expanding and enhancing existing library services to children up to the age of five and their caregivers. New books, audiovisual materials, comfortable furnishings, and expanded hours will enhance the library’s appeal to children and their families. School classes will visit regularly for library activities and grandparent storytelling events, while staff will initiate a supplemental in-school outreach program that takes the library to the children and establishes mini-libraries at the Zeba and Baraga centers on the reservation.",0,"Keweenaw Bay Indian Community",2010,"Native American Library Services: Enhancement Grants",$133779,"Office of Library Services",Baraga,MI
NG-03-10-0255-10,"The Iowa Tribe of Oklahoma will develop the “Starting Points” program that will establish a Literacy, Educational, and Employment Resource Office within the tribal library to assist community members in need of literacy and employment training. This project will allow the tribe to hire a full-time certified teacher to teach reading skills, conduct GED classes, arrange and oversee distance learning instruction, and provide access to vocational and technical classes. In addition, the library will provide and maintain tools necessary for participants to readily create resumes and easily access job-skills training as well as job-search opportunities. The Resource Office will reach a broad community audience and will share resources with six nearby community libraries.",0,"Iowa Tribe of Oklahoma",2010,"Native American Library Services: Enhancement Grants",$87365,"Office of Library Services",Perkins,OK
NG-03-10-0248-10,"The Hopi Tribe of Arizona will add the Kuwan.omp’tap Sikisve (Computer Technology on Wheels) to its already very successful Hopi Tutuqayki Sikisve (Library on Wheels) from an earlier Enhancement Grant. The mobile computer lab will operate in tandem with the current bookmobile's schedule, in order to bring public computer and Internet access to the remote villages throughout the Hopi service area. The intent is to bridge the digital divide between those who can and cannot afford computers and Internet service in their homes, and to provide training that will increase the levels of computer and information literacy of the Hopi population. The mobile computer lab with high-speed Internet access will enable patrons to also take advantage of the many library databases and software programs provided by the Arizona State Library and the Navajo County Library District.",0,"Hopi Tribe",2010,"Native American Library Services: Enhancement Grants",$150000,"Office of Library Services",Kykotsmovi,AZ
NG-03-10-0244-10,"The Jemez Pueblo Community Library in Jemez, NM, is undertaking a multifold project focusing on the preservation of the Towa language and Jemez Pueblo culture, traditions, and knowledge. The new “Towa Cultural Resource Center” in the library will serve as a centralized place to collect, house, and make resources available to tribal members. In collaboration with the Jemez Language Team and Cultural Preservation Officer, the library will offer quarterly workshops on cultural topics. Library staff will be trained by the local PBS affiliate TV station on how to create short videos and audio. These shorts will be produced in Towa, targeting children in early childhood to eighth grade, and based on the Towa Language and Culture School Curriculum already in place. The library will also participate in the SPARK Initiative (Supporting Partnerships to Assure Ready Kids) for children transitioning from preschool to kindergarten, in partnership with other local service agencies.",0,"Pueblo of Jemez",2010,"Native American Library Services: Enhancement Grants",$150000,"Office of Library Services","Jemez Pueblo",NM
NG-03-10-0251-10,"The Menominee Indian Tribe of Wisconsin is working in partnership with the College of Menominee Nation Library Special Collections Department and Wisconsin Heritage Online to house, preserve, catalog, and digitize a large collection of rare and historically significant archival materials, many relating directly to the personal, legal, and national story of the Menominee Tribe’s struggle for sovereignty during the Termination and Restoration period from 1954 to 1973. Project activities will increase online access to these rare documents for the Menominee community, College of Menominee Nation faculty, staff, and students, as well as for public and scholarly research, adding to a greater understanding of the impact tribes felt from the federal termination policy.",0,"Menominee Indian Tribe of Wisconsin",2010,"Native American Library Services: Enhancement Grants",$74520,"Office of Library Services",Keshena,WI
